protocol_id,name,party,gender,start_segment,end_segment,text
prot-1966--ak--25,Gunnel Olsson,Socialdemokraterna,woman,8735.0,9243.35314091681,"Herr talman! Vi är alla överens om att båda de utbildningsformer det här är fråga om behövs i allra högsta grad. Meningsskiljaktigheterna rör enbart förläggningen av den utökade utbildningen. I stor utsträckning har diskussionen därvid kommit att bli densamma som förra året, då vi beslutade oss för universitetsfilialerna. Det framhölls då att även våra största universitet är små, internationellt sett, och att forskningen kräver allt större enheter för att få de resurser den behöver och kunna bedrivas effektivt. Det fanns emellertid många skäl som talade mot att ytterligare bygga ut universiteten och som gjorde att vi i slutomgången stannade för att inrätta universitetsfilialer, samtidigt som forskningen skulle ligga kvar vid moderuniversiteten och resurserna för den mera dyrbara forskningen koncentreras dit. Vi skulle alltså kort sagt sprida utbildningen men koncentrera forskningen, och det är detta man vill göra även när det gäller de båda utbildningsgrenar som i dag diskuteras. Jag behöver inte upprepa alla de skäl som talade för inrättandet av filialerna, men samma skäl gör att de två nya institutionerna bör förläggas utanför de gamla universitetsorterna. : När vi placerade ut universitetsfilialerna var vi också överens om att filialerna i Linköping och Örebro skulle inta en mellanställning och åtminstone inte i första omgången byggas .ut med tanke på att bli universitet, men väl få en starkare ställning än övriga filialer. Det ligger helt i linje därmed att vi nu, sedan Linköping fått en medicinsk och en teknisk högskola, förlägger en socialhögskola och en gymnastikhögskola till Örebro. Här liksom i andra sammanhang kan skäl för och emot anföras, men denna förläggning till Örebro är en konsekvens av vårt tidigare ställningstagande. Det har i debatten här sagts att gymnastikhögskolan bör flyttas längre bort från Stockholm, där den andra: av de båda gymnastikhögskolorna nu är belägen. Det är angeläget att få en större spridning på denna utbildning. Ja, om vi hade haft tre gymnastikhögskolor, borde en av dem ha placerats söder om Stockholm och en norr om Stockholm, men med tanke på befolkningsfördelningen är det orimligt att lägga den ena av två sådana högskolor ända uppe i Umeå. Om en av dem skall inrättas så långt från Stockholm som möjligt, är Lund avgjort den lämpligaste orten. Som redan framhållits är emellertid Lund det av de gamla universiteten som är mest överbelagt och svårast att avlasta, och därmed faller det förslaget. Det är ju också till Mellansverige som befolkningen koncentreras alltmer. Det är därför inte så orimligt, vare sig ur rekryteringseller avnämarsynpunkt, att lägga båda dessa högskolor inom detta område. Vidare har = forskningssynpunkten framhållits. Den diskuterades även ingående i samband med inrättandet av universitetsfilialerna. Man var angelägen att framhålla att universitetsfilialerna måste ha kontakt med forskningen. Den synpunkten måste vi givetvis hålla i minnet även beträffande denna fråga. Men där det talas om att man skall bygga ut forskningen så, att den nya gymnastikhögskolan blir fullt jämbördig med GCI, strider det mot den åsikt som vi tidigare haft, att forsk- ningsresurserna måste koncentreras om forskningen skall bli effektiv. Den fysiologiska institutionen vid GCI är ganska blygsam. Att bygga upp ytterligare en lika blygsam institution, är nog inte det rätta sättet att åstadkomma en effektiv forskning. Vi bör i stället bygga ut fysiologiska institutionen vid GCI och tills vidare låta den vara den enda verkliga forskningsanstalten. Såsom framhölls vid diskussionerna om universitetsfilialerna bedrives det lyckligtvis värdefull forskning även utanför universiteten. Men givetvis skall allt göras för att underlätta forskningen även vid filialorterna, och det är delvis därför som vi strävar efter att på dessa orter få flera institutioner som kan stödja varandra. Det har redan framhållits att för gymnastikoch idrottshögskolan i Örebro är regionssjukhuset i Örebro värdefullt. Detta sjukhus har sådan kapacitet att det ansågs fullt möjligt att inrätta en medicinsk högskola i Örebro. Man måste naturligtvis räkna med att då det endast finns två gymnastikhögskolor dessa skall bedriva ett intensivt samarbete inte minst beträffande forskningen, så att högskolan i Örebro kan utnyttja den forskning som bedrives i Stockholm, erhålla föreläsare därifrån och kanske även utföra en del forskningsuppgifter där. Jag vill erinra om att den mycket värderade förre ledamoten av denna kammare, herr Svensson i Ljungskile, ville förlägga en huvudstadsfilial till Hallsberg. Han bevisade mycket vältaligt att Hallsberg ligger så nära Stockholm att ingen verklig olägenhet var förenad med en sådan spridning av de statliga institutionerna. Sedan han framförde sina argument har genom kommunikationernas ytterligare utbyggnad avstånden krympt ännu mer. Jag tror därför inte att det skulle vara svårt att ordna ett samarbete mellan gymnastikhögskolorna i Örebro och Stockholm. Om den ena av dem flyttas till Umeå, blir det däremot svårare att åstadkomma forskningssamarbete och utbyte mellan dessa högskolor. Om man väger de skäl för och emot som har framförts tror jag att man i likhet med departementschefen och utskottsmajoriteten skall finna att skälen för att förlägga båda dessa nya högskolor till Örebro väger tyngst. Jag ber därför, herr talman, att få yrka bifall till utskottets hemställan på alla punkter."
prot-1966--ak--25,Bo Turesson,Moderaterna,man,9251.34974533107,9317.597623089983,"Herr talman! På tal om förläggningen av den nya gymnastikhögskolan sade fröken Olsson att om det hade varit frågan om att inrätta två nya högskolor, skulle man inte ha förlagt någon av dem i Mellansverige, utan den ena norr om Stockholm och den andra söder om Stockholm. Jag skulle vilja fråga fröken Olsson: Hur kan fröken Olsson veta att det inte i en framtid kommer att finnas ytterligare två gymnastikoch idrottslärarhögskolor? Det sannolika är att så blir förhållandet, fastän det kan dröja länge. Om man då är så övertygad om att de två högskolorna skall ligga norr resp. söder om Stockholm, vore det väl en klok och planmässig åtgärd att nu, när det är fråga om att besluta om den ena, förlägga den på endera stället, så att vi, när den tredje högskolan sedermera skall inrättas, kan placera den på det tredje stället och åstadkomma den spridning över landet som fröken Olsson eftersträvar. Om vi placerar den högskola som den det nu är fråga om i Örebro, så har vi ju för all framtid förstört möjligheterna att få till stånd en spridning."
prot-1966--ak--25,Ove Nordstrandh,Moderaterna,man,9325.084889643465,9396.663837011885,"Herr talman! Det är alldeles riktigt, fröken Olsson, att vi, när vi diskuterade universitetsfilialerna, var överens om att vi skulle sprida utbildningen på universitetsnivå, då optimum var nått vid de gamla universitetsorterna, framför allt i vad det gällde lågstadieundervisningen. Vi beslöt därför att inrätta universitetsfilialer. I fråga om socialhögskolorna är det klart konstaterbart, att optimum vad beträffar utnyttjandet av kvalificerade lärare och liknande på de orter, där dessa högskolor nu ligger, ännu inte är nått. Först när så skett, bör vi diskutera inrättandet av en ny socialhögskola. Parallellismen mellan resonemanget om universitetsfilialerna och om socialhögskolorna är alltså inte fullständig."
prot-1966--ak--25,Gunnel Olsson,Socialdemokraterna,woman,9405.62818336163,9527.988115449916,"Herr talman! Jag sade att om vi skulle ha två gymnastikhögskolor till, borde en ligga norr om och en söder om Stockholm, men om vi endast skall ha en ytterligare gymnastikhögskola, bör den ur spridningssynpunkt absolut förläggas söder om Stockholm. Skälet till att av två nya högskolor den ena borde förläggas norr om Stockholm och den andra söder om Stockholm kan inte anföras för att den enda nya högskolan bör förläggas norr om Stockholm. Om denna högskola med hänsyn till önskvärdheten av större spridning av utbildningen icke skall ligga i Örebro måste vi söka finna en lämplig ort söder om Stockholm i första hand. Det är visserligen möjligt — det vet ingen av oss någonting om — att det en gång i tiden kommer att finnas tre gymnastikhögskolor, men det dröjer i varje fall rätt många år. Med hänsyn till önskvärdheten av att snabbt få igång denna verksamhet för att kunna utbilda de nya gymnastiklärare som så innerligt väl behövs skall vi inte lägga denna högskola på en ort där rekryteringsunderlaget är väsentligt mindre än söder om Stockholm. Vad beträffar optimum för universiteten har icke våra gamla universitet nått optimum annat än i ett hänseende, nämligen i fråga om förmågan att svälja studentkullarna. Huvudskälet till att man måste lätta på trycket på de gamla universiteten var ju att universitetsstäderna inte kan ta emot fler studenter. Ur den synpunkten spelar det ingen roll, på vilken högskola man lättar trycket, om vi plockar in nya studenter på de andra högskolorna, sedan vi nu lyckats överföra en del — tyvärr alltför få — studenter till filialerna. Då har vi tagit tillbaka med den ena handen vad vi har givit med den andra. Jag tror alltså fortfarande att mitt resonemang håller."
prot-1966--ak--25,Johannes Blidfors,Socialdemokraterna,man,9540.65365025467,9788.667232597625,"Herr talman! Jag har till detta utlåtande fogat en blank reservation avseende punkten I, alltså frågan om en socialhögskola i Örebro. Anledningen till min blanka reservation är att denna fråga, enligt min mening inte har fått den allsidiga belysning som man kunde ha önskat. Jag syftar då inte på behovet av en kapacitetsökning, utan på formen för denna ökning. Det förelåg två tänkbara alternativ från början, det ena att bygga ut de nuvarande socialhögskolorna och det andra att upprätta en ny socialhögskola. Nu fick emellertid — som också har framhållits förut i dag — direktiven olyckligtvis en snäv utformning. Jag vill gärna citera dessa direktiv där det bl. a. hette: »De sakkunniga böra i första hand överväga en lokalisering av ifrågavarande utbildningsanstalter till en ort i Mellansverige utanför de nuvarande universitetsoch högskoleorterna. Därvid bör främst Örebro ifrågakomma.» Utredningen hade ju kunnat utnyttja direktivens uttryck »i första hand», men den avstod från denna möjlighet, vilket jag beklagar. Som framhållits här i kammaren har detta också mött kritik från samarbetsnämnden, universitetskanslersämbetet m. fl. instanser. Utredningen hade alltså kunnat utre- da frågan om möjligheten att bygga ut de nuvarande socialhögskolorna, men detta skedde inte. Vi befinner oss därför nu i det läget att endast ett av de två alternativen har blivit utrett och belyst, nämligen en förläggning till Örebro. Några kostnadsjämförelser mellan det ena och det andra alternativet föreligger inte heller. Jag vill inte bestrida departementschefens uttalande att det finns goda förutsättningar i Örebro att snabbt få en lösning till stånd bl. a. tack vare möjligheterna till provisoriska lokaler. Däremot är det naturligtvis mer tveksamt med möjligheterna att ordna lärarrekryteringen i Örebro, men denna sak vill jag inte gå in på. Till sist vill jag framhålla att jag hyser en betydande osäkerhetskänsla om vad som är riktigt och bäst i det ena eller andra fallet. Framför allt beror denna osäkerhet på att vi inte har tillgång till några jämförbara kostnadsförslag beträffande det ena eller andra alternativet. Herr talman! I ett sådant läge kommer jag att på denna punkt avstå från att rösta vid en eventuell votering. I övrigt yrkar jag bifall till utskottets utlåtande."
prot-1966--ak--25,unknown,unknown,unknown,9804.79626485569,10160.178268251275,"Herr talman! Jag har också en blank reservation fogad till detta utskottsutlåtande. Inledningsvis skulle jag vilja ifrågasätta, om utredningarna verkligen varit förutsättningslösa beträffande förläggningsorten för de föreslagna högskolorna. Redan i direktiven föreslogs att främst Örebro borde komma i fråga som centrum för den utbildning det här gäller, men i utredningen saknas ett utförligare resonemang om valet av lokaliseringsort. Man skulle ju kunna tänka sig att städer som Linköping och Uppsala också kunnat komma i fråga. Jag har emellertid solidariserat mig med propositionen och utskottsutlåtandet på denna punkt och kommer alltså vid voteringen att rösta på utskottsutlåtandet. Då jag har väckt motionen II: 852 vill jag emellertid säga några ord om de förbättringar jag önskar skall komma till stånd i samband med de föreslagna högskolorna i Örebro. Det gäller särskilt önskvärdheten av att det upprättas ett gemensamt högskolebibliotek där. Även flera remissinstanser har uttalat sig för det. Tillgången på såväl referenssom kurslitteratur i riklig omfattning är en förutsättning för en effektiv utbildning. I propositionen har föreslagits att stadsbibliotekets resurser skulle anlitas, och det är alltid en lösning, även om den inte är den allra bästa. Det står emellertid i utskottets utlåtande: » Vidare avses en samordning i fråga om biblioteksverksamheten för de båda högskolorna.» Jag har låtit mig nöja med denna utskottets skrivning. Vad sedan gäller anslaget till bokinköp vill jag hänvisa till riksbibliotekariens yttrande rörande utredningens beräkningar av det årliga anslaget för sådana inköp. Enligt hans mening är det anslaget alltför knappt tilltaget och borde uppräknas med 50 procent. Jag har i min motion också uttalat önskemål om ett högre anslag än vad departementschefen föreslagit. Den tredje punkten gäller förslaget om inrättandet av ett ordinarie universitetslektorat i rättskunskap, särskilt förvaltningsrätt, vid högskolan i Örebro. Erfarenheten har visat att antalet kompetenta sökande i ämnet är ganska begränsat, och man kan därför ifrågasätta om någon sådan tjänst bör inrättas. Med hänsyn till att första årets grundkurs huvudsakligen är samhällsvetenskapligt inriktad hade det kanske varit riktigare och bättre att i stället inrätta ett universitetslektorat i ämnet sociologi. Slutligen vill jag också säga något om handikappidrotten, som är en viktig gren inom handikappvården, inte minst genom sin kontaktskapande förmåga. Därför är det anmärkningsvärt att det såvitt jag vet inte lämnas någon som helst orientering om handikappidrott i utbildningen för gymnastiklärare. När det t.ex. anordnas sommarläger, är ofta en av svårigheterna just att få kompetenta ledare. En utväg att lösa det problemet borde vara att en kort orientering om handikappidrottens betydelse och dess olika former samt den särskilda pedagogik som där kräves lades in i utbildningen av gymnastiklärare. Vi har emellertid i utskottets utlåtande skrivit följande om handikappidrotten och det tycker jag är både tydligt och kraftigt: »Utskottet finner det vara av väsentlig betydelse att blivande gymnastiklärare erhåller en sådan orientering. I detta sammanhang vill utskottet erinra om att gymnastikoch idrottslärarutredningen i sitt betänkande beträffande idrottslärarutbildningen framhållit att det bör vara möjligt för de blivande idrottslärarna att bl. a. specialisera sig på handikappidrott. Utskottet anser sig böra förutsätta att de ansvariga för utbildningen av gymnastikoch idrottslärare kommer att ha sin uppmärksamhet riktad på de handikappades särskilda problem när det gäller gymnastik och idrott samt kommer att vidtaga härav föranledda åtgärder.» Jag vill understryka vikten av detta. Det är, tycker jag, en så pass positiv skrivning att det borde ha föranlett en skrivelse från riksdagen till Kungl. Maj:t i denna angelägna fråga. Herr talman! Jag har inget annat yrkande än bifall till utskottets hemställan."
prot-1966--ak--25,Tore Nilsson,Moderaterna,man,10169.70288624788,10666.629881154498,"Herr talman! Jag vill börja med att instämma i vad herr Källstad sade om handikappidrotten. I övrigt skall jag hålla mig till vad som står i reservationen 2 till utskottets utlåtande. Den som har lyssnat på debatten här och läst trycket märker enigheten om behovet av den nya högskolan för utbildning av lärare i gymnastik och idrott. Däremot är vi inte eniga om platsen för högskolan. Inför propositionens förslag, inför direktiven till utredningen, där förläggningsorten redan anges, vilket för mig ter sig mycket underligt, och inför utskottets skrivning i utlåtandet måste man fråga: Varför Örebro? Och varför skulle utredningen söka en plats just i Mellansverige? Jag säger det inte för att det är något fel på Örebro i och för sig. Herr Nordstrandh sade att det är en förnämlig stad, och den uppfattningen delar jag. Men efter inläggen här i kammaren i dag står jag med samma spörsmål obesvarat: Varför Mellansverige? Lokalpatriotism ligger inte bakom min fråga, i varje fall inte i första hand. Ofta förefaller mig lokalpatrioter motbjudande — de har så lätt för att odla egenkärlek och trångsynthet. Det är i den praktiska nyttans, saklighetens och rättvisans intresse man frågar om anledningen till lokaliseringen i detta fall. Mellansverige har ju redan en högskola, och GCI skall därtill också utvidgas med en idrottslärarlinje. Naturligtvis skulle Örebro »klara» en högskola, men det finns mycket som Örebro inte har och som här väger tungt i vågskålen. Jag har inte funnit några sådana tungt vägande skäl för just Örebro. Denna gång skall jag begränsa mig till ett par motiveringar för högskolans förläggning till Umeå utöver det som redan sagts, nämligen vinteridrotten och anknytningen till det där befintliga universitetet. Vintern i år har väl givit Örebro lika mycket snö som Umeå, men Norrland har även under så onormala vintrar som årets rikare möjligheter till skid- åkning och annan vintersport. Backar, banor och spår är på sätt och vis naturligare belägna där. Umeå har anknytning till en provins, som sedan gammalt är vintersportens förlovade land. Umeå erbjuder större möjligheter genom sin relativa närhet till vårt lands alpina terräng — till fjällen, där störtlopp och slalom har bättre förutsättningar. En idrottslärare har behov av praktik även i sådan miljö. Utbildningen av lärare i gymnastik och idrott bör självfallet förläggas till en plats där också vinterns övningsområden har naturliga förutsättningar, när vi nu är så rikt utrustade att vi också har ett Vintersverige. I min barndom såg jag i min hemort militärer från södra Sverige som kom upp dit för att lära sig åka skidor, och jag förundrade mig över att det i vårt land fanns trakter där man inte kunde lära sig att åka skidor utan måste resa så långt för att göra det. Jag skulle också tro att alla riksdagsmän förstår vikten av att vinterns idrottsgrenar inte missgynnas. Visserligen har Norrland också sin ljusa vår och sin intensiva sommar, och i övre och mellersta Norrland utövas livligt idrott även under dessa årstider. Men allsidigheten kräver att vinteridrotten får ett betydande utrymme och att de blivande gymnastiklärarna lär känna den rätta miljön därför redan under sin utbildning. Därtill kommer vad som sagts om det värdefulla i universitetets närhet. Gymnastikhögskolans utbildningsverksamhet kräver dock tillgång till vissa forskningsorganisationer, som finns i universitetsstaden Umeå men icke i Örebro. Samverkan mellan gymnastiklärarhögskolan och universitetsinstitutioner är av största betydelse. En viss samordning i läraravseende är inte heller otänkbar. Medicinska ämnesområden som anatomi och hygien — för att nämna två exempel — som i Umeå har sina forskningsinstitutioner är av stort värde för högskolan. Här vill jag vända mig till fröken Olsson, som talade om den fysiologiska institutionen i Stockholm i anknytning till GCI. Jag tror att det skulle betyda mycket även för den medicinska utbildningen i Umeå att ha tillgång till en gymnastikoch idrottshögskola i närheten. Det vore alltså bra även för universitetet att denna högskola fanns där. Sedan har vi sambandet med den lärarhögskola som redan är förlagd till Umeå — någonting liknande finns ju inte i Örebro. Ur effektivitetssynpunkt är en förläggning till Umeå det klokaste, och till den allsidiga norrländska högskolan hör även den högskola som vi i dag skall besluta om. Därtill tycker jag att det är ett rättvisekrav att man i Mellansverige går med på att en annan landsdel får den nya gymnastikhögskolan, när Mellansverige har den första. Jag är medveten om att Lund eller Göteborg också kunde komma i fråga. Men just med hänsyn till allsidigheten och året-runt-effektiviteten måste Umeå sättas i första rummet. Jag skulle tro att den ungdom som söker utbildning också gärna reser till Norrland och dess friska vinter. I dagarna har publicerats en undersökning som visar att även utländska studenter trivs alldeles utmärkt i Norrland. De är visserligen inte så många, men de finns där i alla fall. Den norrländska ungdomen har gjort starka insatser på hithörande områden och kunde förtjäna den uppmuntran och den stimulans som högskolans placering i norr skulle innebära. I motion 1:693 står det: »Några nämnvärda nackdelar förenade med Umeå som förläggningsort för gymnastiklärarutbildning har vi inte funnit.» Fröken Olsson tog ett par gånger ordet »orimligt» i sin mun. Hon tyckte det var så »orimligt» att lägga högskolan »så långt bort» som »ända i Umeå». Hon uttalade ordet »ända» med en skräckinjagande betoning, som ingav mig en känsla av att hon tror att Umeå ligger i närheten av nordpolen. Umeå vore enligt fröken Olsson »så oändligt avlägset», och rekryteringsunderlaget blir alldeles för litet. Jag kan inte förstå annat än att även om det främst blir bra för norrlänningarna att få studera just vid gymnastikhögskolan i Umeå, är rekryteringsunderlaget hela Sverige också i detta fall. Det är väl inte förmätet av mig att hoppas att flertalet av kammarens ledamöter skall ta det sakligt riktiga i betraktande och stödja det förslag som siktar både till spridning av utbildningen och till de praktiska fördelar som en förläggning till Umeå innebär. Jag är inte någon siare, men jag skulle vilja säga: Om högskolan förläggs till Norrland tror jag att man om ett tiotal år kommer att förvånas över att det någonsin varit meningen att högskolan skulle inrättas i något annat område. Med detta ber jag, herr talman, att få yrka bifall till reservationen 2."
prot-1966--ak--25,Gunnel Olsson,Socialdemokraterna,woman,10678.718166383704,10779.07470288625,"Herr talman! Om vissa lärare vid gymnastikhögskolan skulle undervisa i vinteridrott och andra i sommaridrott skulle vi självfallet, herr Nilsson i Agnäs, förlägga den ena utbildningsanstalten till Umeå. Men samtliga lärare skall i första hand — åtminstone i denna omgång — undervisa i gymnastik, och samtliga skall sedan undervisa i såväl vinteridrott som sommaridrott. Det är alldeles riktigt att det under låt mig säga normala vintrar går dåligt att träna vinteridrotter så här långt ned i landet. Därför förläggs ju också kurserna i vinteridrott regelmässigt till Norrland. På det sättet får man naturligtvis göra även i fortsättningen, men det gäller härvidlag en ganska begrän- När det så småningom skall utbildas speciella idrottslärare får man naturligtvis i större utsträckning förlägga kurser i vinteridrott till Norrland. Men det blir en senare fråga. Jag tror fortfarande att om vi skulle lägga den ena högskolan i Umeå, så bleve det nödvändigt att under stora delar av året flytta ned eleverna hit för att de skulle kunna få den utbildning i utomhusidrott av alla slag som det åtminstone under hårda vintrar blir för kort tid till uppe i Umeå. Som sagt: Skulle vi ha speciallärare i vinteridrott vore Umeå den självklara förläggningsorten, men så är inte förhållandet när alla lärare skall utbildas för hela fältet."
prot-1966--ak--25,Tore Nilsson,Moderaterna,man,10788.106960950765,10845.0,"Herr talman! Jag ville säga till fröken Olsson att det inte finns något hinder för att utöva sommaridrott i Umeå. Det har nyligen hållits en stadslöpning i Stockholm och det var då en norrländsk förening som vann, trots att tävlingen ägde rum så tidigt på året som i början av maj. Jag tror inte att det är någon risk för att man skulle behöva flytta ned sommarutbildningen från Umeå till södra Sverige. Jag förmodar att så mycket av det som skall göras utomhus kan förläggas till den tid, då det är möjligt att genomföra dessa moment även i Norrland, att detta blir onödigt. Gymnastikutbildningen är väl dessutom under alla förhållanden delvis förlagd inomhus. Några särskilda lärare för vinteroch sommaridrott har jag aldrig ifrågasatt, utan utbildningen på båda dessa idrottsområden kan bedrivas i Umeå."
