protocol_id,name,party,gender,start_segment,end_segment,text
prot-1966--ak--25,Gunnar Sträng,Socialdemokraterna,man,858.5653650254669,940.874363327674,"Herr talman! Herr Nihlfors har frågat, om jag ämnar vidtaga personalförstärkning eller andra åtgärder för att den påbörjade revisionen av taxeringar inom byggnadsbranschen avseende inkomståret 1960 skall hinna slutföras innan preskriptionstiden utgår. Det kan till en början konstateras att den personal som sysslar med taxeringsrevision inte är tillräcklig. Den utbyggnad av taxeringsrevisionen som beslöts år 1961 har inte gått i den takt man då räknade med. Detta har flera orsaker. Det har varit svårt att få kompetent personal. Den rutinerade revisionspersonalen har dessutom måst tagas i anspråk för utbildning av den nya personalen. Under hösten 1965 och våren 1966 har på möten med landskamrerare samt taxeringsoch revisionsintendenter diskuterats möjligheterna att intensifiera taxeringsrevisionen. Det har därvid från finansdepartementet och riksskattenämnden <understrukits nödvändigheten av att alla åtgärder vidtas för att revisionspersonalen skall få ägna sig åt s. k. offensiv taxeringsrevision. Jag är därför övertygad om att alla ansträngningar kommer att göras i fråga om de revisioner som frågeställaren avser."
prot-1966--ak--25,Folke Nihlfors,Folkpartiet,man,946.6808149405772,1042.9966044142616,"Herr talman! Jag får tacka för det mycket positiva svaret från finansministern. Det visar att svårigheterna är stora att genomföra de anbefallda taxeringsrevisionerna. Det sticker i ögonen på den stora allmänheten, som utan anmärkning gör sina deklarationer och får skatta för sina inkomster till sista kronan, att taxeringsmyndigheterna inte hinner med granskningsarbete som tycks ge åtskilligt i utbyte genom efterbeskattning. Beträffande de i min fråga berörda fallen har det rapporterats att man hittat åtskilliga miljoner kronor i inkomster, för vilka vederbörande inte har deklarerat, och att preskriptionstidens utgång troligen skulle rädda stora inkomsttagare, som deklarerat fel, från dryga efterräkningar. Koncentration behövs verkligen på den s. k. offensiva taxeringsrevisionen. Man bör därvid släppa efter på det intresse som ibland, ja ganska ofta, visas mindre inkomsttagare, som får förfrågningar om ett och annat smärre avdrag, vilket tyder på att det i vissa fall kan förekomma en synnerligen noggrann och förmodligen ganska tidsödande granskning av småsaker. De stora grupperna löntagare skulle säkerligen hälsa med tillfredställelse, om man också kunde se till att utbyggnaden av taxeringsrevisionen snabbare kom till stånd. Eventuellt får man kanske tänka om och erbjuda bättre löner för att få kompetent personal. En investering på detta område måste ge synnerligen god utdelning för statskassan utan skattehöjning."
prot-1966--ak--25,Manne Ståhl,Folkpartiet,man,1128.2427843803057,1251.0101867572157,"Herr talman! Jag ber att få tacka för svaret som jag finner helt tillfredsställande. Jag tror att jag kan tillägga att det även kommer att tillfredsställa en ganska talrik befolkning i gränstrakterna. Ett av de fall som kommit till min kännedom och som föranlett mig att ställa denna fråga gällde en person, som bor på den norska sidan och som håller på med timmerdrivning på den svenska. Han transporterar timret som exportgods över till Norge. Han ålades att deponera 8000 kronor som säkerhet för traktorn, och sedan måste han, om han höll på mer än en månad, betala tull på 10 procent av värdet för varje månad han höll på med verksamheten. När detta påtalades hos vederbörande tullmyndigheter förklarades det, att även de skulle vara tacksamma för en något klarare fixering av vad som skall gälla på detta område, därför att gränsdragningen nu är mycket vag. I tulltaxeförordningen (SFS 1960: 392) står det i 8 16 beträffande bostadsorten, att vederbörande skall vara etablerad »i gränstrakterna», att han skall söka sig till »närbelägen ort» i Sverige och att det skall gälla »kortare tid». Man måste medge att detta är mycket diffust uttryckt. Det är riktigt att praxis bör vara generös, men man måste det oaktat eftersträva en relativt enhetlig praxis. Jag tar fasta på uttalandet om konferensen i höst. Jag tar för givet att vederbörande tullförvaltning som har med detta att göra då skall aktualisera frågan just till följd av vad finansministern här har meddelat. Jag tackar ånyo för svaret."
prot-1966--ak--25,Gunnar Lange,Socialdemokraterna,man,1262.23259762309,1304.6943972835315,Herr talman! Herr Fridolfsson i Stockholm har hemställt om en redogörelse för den tillsatta priskommitténs målsättning mot bakgrund av de ound- vikliga kostnadsökningar som kommer att belasta näringslivet. Jag vill svara följande. Regeringen har inte tillsatt någon sådan kommitté som avses i den framställda frågan. Däremot har socialdemokratiska partiet och Landsorganisationen uppdragit åt en grupp under ledning av riksdagsmannen Skoglund att granska verksamheten på prisoch konkurrensområdet. Gruppen är således redovisningsskyldig till partiet och Landsorganisationen. Värdefulla förslag kommer naturligtvis att prövas i vederbörlig ordning.
prot-1966--ak--25,Filip Fridolfsson,Moderaterna,man,1307.8522920203736,1461.9949066213921,"Herr talman! Jag ber att få tacka handelsministern för svaret. Avsikten med frågan var naturligtvis att få ett besked huruvida handelsministern ansåg att den tillsatta priskommittén räknade med att de kostnadsfördyringar som föranletts av bl. a. högre löner, högre ATP- och sjukförsäkringsavgifter samt högre hyror och frakter skulle leda till högre priser på produkterna. Jag är väl medveten om att regeringen inte har tillsatt någon kommitté, men med hänsyn till att det har gjorts så stor affär av denna priskommitté och med tanke på det stora allmänna intresset för denna fråga trodde jag dock att jag skulle ha kunnat få ett svar på min fråga. Den knivskarpa konkurrensen på praktiskt taget alla områden inom näringslivet garanterar att inga onödiga prishöjningar sker. Den som i dag inte kan driva sitt företag rationellt och därigenom kan erbjuda konsumenterna och kunderna varor till konkurrenskraftiga priser kan inte existera. Statsrådet känner säkert till att trots en långtgående rationalisering har många företag måst lägga ned sin verksamhet på grund av att de inte kunnat bära kostnadsök- ningarna. För praktiskt taget alla övriga företag har den genomgående utvecklingen varit att man tvingats betala en stor del av kostnadsökningarna med ett beskuret överskott på rörelsen; man hade med andra ord fått nöja sig med en blygsam vinst. I vissa fall har man fått vara glad över att bara ha kunnat balansera rörelsen. Det enskilda näringslivets konkurrenskraft är välbekant; den framträder inte minst när man ser de statliga företagens svårigheter. Jag förmodar att det inte finns någon som har någonting emot att det tillsätts kommittéer med uppgift att följa prisutvecklingen, men den aktuella priskommittén är enligt min uppfattning ingenting annat än en ren propagandamanöver. Den har tillsatts av socialdemokrater och deras sympatisörer för att dölja de kostnadsökningar som automatiskt följer av deras politik."
prot-1966--ak--25,Gunnar Lange,Socialdemokraterna,man,1468.0050933786079,1557.5976230899832,"Herr talman! Det är inte min avsikt att vid detta tillfälle inbjuda till en allmänt omfattande prisdebatt; kammarens ledamöter kommer ju inom kort att få diskutera den ekonomiska politiken, jag vet inte för vilken gång i ordningen under denna session. Jag kan emellertid inte låta herr Fridolfssons i Stockholm påståenden stå oemotsagda i dag. Det är egentligen inte någonting nytt att högern anser att den hårda konkurrensen hindrar onödiga prisstegringar. Med denna utgångspunkt har högerpartiet motsatt sig varje förslag att göra prisövervakningen mera effektiv, och högern har också vänt sig mot varje skärpning av lagstiftningen. Jag kan erinra om ställningstagandet till regeringens förslag beträffande möjligheterna för näringsfrihetsrådet att vid vitesföreläggande föreskriva åläggande av leveranstvång. Jag skall inte nu debattera detta utan vill bara fastslå, att det dess värre inte förhåller sig så, att konkurrensen hindrar varje onödig prisstegring, vilket klart framgår bl. a. av det material som prisoch kartellnämnden vid flerfaldiga tillfällen givit offentlighet åt."
prot-1966--ak--25,Filip Fridolfsson,Moderaterna,man,1564.2359932088284,1597.0033955857384,"Herr talman! Högerpartiet menar att den hårda konkurrensen är den bästa prisnedsättande faktorn. Att socialdemokrater genom att utse en kommitté vill framstå som konsumenternas beskyddare är att försöka dölja, att man inte på något sätt klarar av inflationsvågen."
prot-1966--ak--25,Gunnar Lange,Socialdemokraterna,man,1611.3667232597622,1713.1494057724958,"Herr talman! Herr Nilsson i Tvärålund har frågat mig, om jag observerat de missförhållanden, som i vissa fall kan uppstå genom att fortsatt koncession för distributör av elkraft vägras, och vilka åtgärder jag i så fall har för avsikt att vidtaga. Herr Nilssons fråga har samband med den rationalisering av eldistributionen, som riksdagen beslöt år 1957. Rationaliseringen innebär att distributionsenheternas bärkraft ökas genom att distributionsföretag, som bedöms alltför små, förmås uppgå i större. För att främja denna utveckling beviljas inte områdeskoncession för de distributionsföretag, som på sikt inte är ändamålsenliga. Kommerskollegium — som är tillståndsmyndighet — söker därvid bl.a. att i stället kortfristigt förlänga giltiga linjekoncessioner när dessa löper ut. Distributionsföretagen får härigenom tid på sig för att förhandla om samgående t.ex. med angränsande företag. I stort sett har denna ordning fungerat väl, och efter vad jag inhämtat från kommerskollegium har det inte förekommit att någon distributionsförening vägrats förlängning av linjekoncession. Denna överföring av koncessionerna från inte ändamålsenliga distributionsföretag till mera rationella kan emellertid i vissa fall medföra problem. Delvis hänger dessa samman med att det saknas fasta regler för överlåtelse av linjenät från äldre till ny koncessionsinnehavare. Dessa och andra frågor av betydelse för rationaliseringen av elkraftdistributionen utreds för närvarande i nära kontakt med kommerskollegium."
prot-1966--ak--25,John Eriksson,Centerpartiet,man,1722.8438030560274,1982.4193548387098,"Herr talman! Enär frågeställaren Jan- Ivan Nilsson i Tvärålund själv är förhindrad att ta emot detta svar, har jag blivit anförtrodd att framföra ett tack till herr statsrådet för svaret. Frågan har ställts på grund av förhållandena och erfarenheterna i Västerbotten beträffande tillämpningen av koncessionsbestämmelserna. Dessa bestämmelser torde emellertid vara allmängiltiga för landet i dess helhet. I den pågående strukturrationaliseringen av eldistributionen medges de nuvarande distributionsföreningarna i vissa fall förlängd koncession, som dock oftast är begränsad till ett å två år. Detta är enligt min mening alldeles för kort tid för att få en väl planerad strukturrationalisering. Därtill kommer att en så kort koncessionstid kan innebära en klart försämrad elservice för abonnenterna. Det ligger ju i sakens natur att den eldistributionsförening, som får sin koncession förlängd med bara ett å två år, inte företar det underhåll av och de investeringar i ledningsnätet, som i många fall fordras för att abonnenterna skall få en tillfredsställande elförsörjning. Ur dessa synpunkter bör koncessionerna inte gärna förlängas kortare tid än tio år. De större elföretag som skall övertaga de mindre = distributionsföreningarna bör också ha god tid på sig att planera övertagandet och inpassa föreningarna i sitt distributionsnät. I sitt svar understryker statsrådet de problem som sammanhänger med dessa överlåtelser, och statsrådet meddelar att dessa och andra frågor av betydelse för rationaliseringen av elkraftdistributionen för närvarande utredes i nära kontakt med kommerskollegium. Det är ett svar som vi väl har anledning känna oss till freds med, i varje fall om den koncessionsbeviljande myndigheten kan medge en något större förlängning av koncessionstiden än som nu tillämpas och som medför de problem jag här nämnt om och som statsrådet tydligen delar. Vidare tycks man i Västerbotten ha gjort den erfarenheten, att vattenfallsstyrelsen tolkar lagstiftningen rörande områdeskoncession så, att verket skulle ha något slags monopol på övertagandet av de distributionsföreningar som nödgas upphöra. Jag vill därför fråga statsrådet, om inte lagstiftningen på detta område bör tillämpas så, att också vattenfall får ställa sig i kön av privata distributionsföretag som anmäler sitt intresse och som i övrigt uppfyller lagstiftningens krav. Herr talman! Jag ber att än en gång få tacka herr statsrådet för svaret."
prot-1966--ak--25,John Eriksson,Centerpartiet,man,2050.042444821732,2103.3191850594226,"Herr talman! Jag delar statsrådets synpunkter när det gäller strukturrationaliseringen på eldistributionens område. Jag är fullt medveten om att vi i dag har många små och olönsamma distributionsföretag. Å andra sidan tror jag att man just i övergången för att få en vettig planering och en inpassning i det stora distributionsnätet inte får ta till den förlängda koncessionstiden alltför kort, detta just för att man skall nå den effekt av rationalisering och planering som jag tror att man genom lagstiftningen önskar nå. Jag vill ta fasta bl. a. på statsrådets löfte om möjligheten att efter en förlängning få en ytterligare förlängd koncessionstid. Därigenom skulle man kanske kunna tillgodose de önskemål jag berört."
prot-1966--ak--25,Herman Kling,Socialdemokraterna,man,2113.539898132428,2146.0865874363326,"Herr talman! Herr Oskarson har frågat mig, om jag avser att vidtaga några åtgärder i syfte att motverka innehav och försäljning av s. k. lyssnarapparater, vilkas användning uppenbart hotar den enskildes integritet. Som svar på frågan får jag liksom i mitt svar i går i första kammaren på herr Nymans interpellation meddela, att problemet med lyssnarapparater sedan en tid varit föremål för justitiedepartementets uppmärksamhet. Direktiv för en utredning i ämnet har numera offentliggjorts."
prot-1966--ak--25,Gunnar Oscarsson,"Moderaterna, Högerpartiet",man,2151.5874363327675,2240.432937181664,"Herr talman! Jag ber att få tacka justitieministern för svaret. Svaret är av det slag att man måste förklara sig fullt nöjd. Jag fick bara för några minuter sedan utredningsdirektiven i min hand, och efter en snabb genomläsning tror jag mig kunna säga, att de går ut på att utreda just de problem som vi här har varit oroade för. Vad som gjort att man särskilt har oroats på senaste tiden är de TV-program som givits angående dessa lyssnarapparater. Dessutom försäljs de nu i landet fritt till vem som vill köpa dem. Det är ett antal postorderfirmor som utannonserar dem till ett mycket billigt pris. Man kan köpa en sådan apparat för 46 kronor, och prov har visat att de ger en fullgod avlyssning från rum till rum. Det blir en skrämmande utveckling, om apparaterna skulle få hanteras fritt i oansvariga människors händer. Därför är det med tillfredsställelse som vi har fått del av dessa utredningsdirektiv, och jag vill bara uttrycka en förhoppning om att utredningen arbetar snabbt."
prot-1966--ak--25,Herman Kling,Socialdemokraterna,man,2245.7470288624786,2253.2342954159594,Herr talman! Jag är säker på att försäljarna av dessa apparater är djupt tacksamma för den utomordentliga reklam som herr Oskarson nu har gett dem.
prot-1966--ak--25,Gunnar Oscarsson,"Moderaterna, Högerpartiet",man,2260.1612903225805,2275.509337860781,Herr talman! Jag kan inte tillmäta min enkla fråga så stor reklambetydelse som justitieministern tycks göra. Jag tillmäter våra TV-program betydligt större reklamvärde — så blygsam är jag.
prot-1966--ak--25,Herman Kling,Socialdemokraterna,man,2286.25636672326,2446.935483870968,"Herr talman! Herr Werbro har frågat mig, om jag vill redogöra för praxis vid beviljandet av permissioner från sluten fångvårdsanstalt. Som svar får jag anföra. De grundläggande bestämmelserna om permission från fångvårdsanstalt finns i lagen den 6 maj 1964 om behandling i fångvårdsanstalt. Dessa bestämmelser har kompletterats genom utförliga tillämpningsföreskrifter. Det kan inte komma i fråga att inom ramen för ett svar på en enkel fråga ange mera än några huvudpunkter i de normer som tillämpas för permission. Man skiljer mellan särskild permission och regelbunden permission. Särskild permission, som kan beviljas oavsett anstaltstidens längd, medges under förutsättning att i det särskilda fallet starka skäl förebringas för permission. Regelbunden permission är ett normalt led i verkställigheten för alla som avtjänar längre straff. För båda slagen av permission gäller som förutsättning att fara för missbruk inte kan anses föreligga. Vid slutna anstalter för det vanliga klientelet tillämpas regelbunden permission endast när strafftiden uppgår till lägst ett år sex månader. Förstagångspermission brukar, utom vid de längsta anstaltstiderna, beviljas efter tio månader och ny permission fyra månader efter den föregående permissionens början. Den som undergår fängelse på livstid får i allmänhet inte permission förrän tidigast efter tre år. Stor varsamhet iakttas vid beviljande av särskild permission. Sådan permission får enligt tillämpningsföreskrifterna i regel förekomma endast i följande fall: 1. för att besöka närstående som är svårt sjuk eller bevista närståendes begravning, De normer som jag här i korthet redogjort för är att fatta endast som allmänna principer som kan frångås, om särskilda förhållanden fordrar det."
prot-1966--ak--25,Wiking Werbro,Liberalerna,man,2452.741935483871,2605.8998302207133,"Herr talman! Jag ber att få tacka justitieministern för svaret. Med tanke på den debatt som förts rörande permissioner från slutna fångvårdsanstalter tror jag det har stor betydelse att detta svar lämnats. På några punkter ställer jag mig dock en smula frågande, huruvida tillämpningen av bestämmelserna sker enligt de normer som angivits i svaret. Ett aktuellt fall gäller en dom efter ett mord. Mordet förövades genom en liga, och ledaren för denna liga dömdes till ett långvarigt straff. Hovrätten meddelade dom så sent som den 15 februari i år, och domen vann laga kraft den 13 maj. När domen vann laga kraft hade emellertid internen redan fått permission, och han befinner sig fortfarande på fri fot — han har inte inställt sig till anstalten igen. Det befaras att han inte finns inom landet. Jag ställer mig därför frågande till om man ordentligt prövar den tid som skall gå innan permission beviljas. Vidare kan ifrågasättas om man i praktiken tillämpar den norm som justitieministern anger, när han i en passus av svaret säger: »För båda slagen av permission gäller som förutsättning att fara för missbruk inte kan anses föreligga.» I det fall som jag här relaterat kan väl just riskeras att missbruk skulle kunna anses föreligga — det fanns risk för annan persons liv, om den dömde kom ut. Ligan finns nämligen kvar, och det har under utredningen visat sig att personen i fråga var en verklig fanatiker — han hade en fantastisk disciplin över ligamedlemmarna, och det gick ju så långt att han fick dem att begå ett mord. Att släppa en sådan person fri, innan domen vunnit laga kraft, finner jag något egendomligt och kanske inte i enlighet med de direktiv som utfärdats för anstalterna. Jag hoppas att justitieministern tar detta i beaktande, så att ett upprepande inte sker."
prot-1966--ak--25,Herman Kling,Socialdemokraterna,man,2613.404074702886,2666.4261460101866,"Herr talman! Jag är naturligtvis förhindrad att här diskutera det enskilda fallet, men jag utgår från att det var fråga om en s.k. särskild permission under bevakning eller motsvarande. Olyckor kan man aldrig förebygga. Vad beträffar frågan huruvida fara för missbruk kan anses föreligga måste det ju bli en bedömning från fall till fall. Även storrymmare och livstidsfångar måste förr eller senare föras ut i det vanliga livet — det är ingen som avsett att de skall tillbringa hela sitt liv i anstalterna. Därför måste man ta vissa risker."
prot-1966--ak--25,Wiking Werbro,Liberalerna,man,2668.20882852292,2703.6078098471985,Herr talman! Jag vill instämma i justitieministerns uttalande att man skall bevilja permissioner åt internerna. Det är givet att man skall göra så. Men det är enligt min mening uppenbart att man i många fall ger permission åt sådana som inte kan sköta denna. Justitieministern uttalar i sitt svar: »För båda slagen av permission gäller som förutsättning att fara för missbruk inte kan anses föreligga.» Det är min förhoppning att bedömningen skall bli något strängare på denna punkt.
prot-1966--ak--25,Herman Kling,Socialdemokraterna,man,2716.5789473684213,2764.9830220713075,"Herr talman! Herr Wiklund har frågat mig, när förslag om reformerad polisutbildning kan komma att föreläggas riksdagen. Som svar får jag anföra följande. 1962 års polisutbildningskommitté avlämnade förra året ett betänkande som därefter har remissbehandlats. För närvarande överarbetas kommitténs förslag inom berörda departement. Från början har det varit klart att en reformering av polisutbildningen i enlighet med dessa förslag kommer att kräva kostnader. Något ställningstagande till förslagen kan därför inte ske förrän tidigast under budgetbehandlingen i höst. I det sammanhanget får också prövas, om delar av detta komplex kan brytas ut och behandlas tidigare än andra avsnitt."
