protocol_id,name,party,gender,start_segment,end_segment,text
prot-1966--ak--25,Erik Grebäck,Centerpartiet,man,9591.078098471986,10078.37860780985,"Herr talman! Orsaken till att jag lägger mig i denna socialdemokratiska familjeträta är den att jag av olika anledningar kommit att ganska ingående syssla med de problemställningar som berörts i interpellationen och i debatten här. Herr Lundberg har i sin interpellation presenterat ett samhällsekonomiskt handlingsprogram. Han talar om hur naturresurserna, arbetskraften och ka- pitalet skall användas — i första hand i mälarregionen men i stort sett i landet för övrigt. Han anklagar regeringen för brist på initiativkraft och handlingskraft, och det finns väl ingen anledning för mig att motsäga honom i detta fall. Det måste väl vara sant, eftersom det är en av de egna som gör påståendet. Det är emellertid alldeles klart att i frågor av så kontroversiell art som det här gäller är det oerhört angeläget att de avvägningar som måste göras av samhällsplanerare och politiker blir så noga penetrerade som möjligt. Jag kan instämma med statsrådet Johansson i att det inte räcker med bara en regional planering, utan dessa frågor måste handläggas med hänsyn till hela samhällets behov. Jag vill också helt instämma i vad herr Lundberg karakteriserade som skriet från vildmarken. Jag kommer också från dessa vildmarker uppe i Roslagen, och jag vet att för oss gäller det här en mycket angelägen sak. Jag skulle emellertid vilja belysa den från en annan utgångspunkt än som skett tidigare. Ytterst gäller problemet hur vi skall kunna utnyttja det virkesförråd som finns i mälarregionens skogar och dessa skogars tillväxt. Enligt senaste skogstaxering är den årliga tillväxten 3,2 miljoner skogskubikmeter, och mot den svarar en avverkning på 1,8 miljon skogskubikmeter. Vi har sålunda för närvarande en underavverkning på 1,4 miljon skogskubikmeter, om hänsyn bara tas till den årliga tillväxten. Man räknar emellertid med att omloppstiden i skogarna, särskilt i Stockholms län, för närvarande är 200 år, och de nämnda siffrorna innebär att föryngringsytorna där nu bara utgör 50 procent av vad de borde vara. Vi avverkar inte tillnärmelsevis de virkeskvantiteter som vi teoretiskt har möjlighet att göra. Från det område det här gäller skeppas årligen stora mängder timmer till Finland. Våra industrier har inte tillräcklig kapacitet för att på ett rationellt sätt utnyttja virkesförrådet. Hur skall vi klara den saken? Ja, jag kan inte komma till någon annan slutsats än att vi måste sätta in mer arbetskraft och kapital. Hur skall vi annars kunna utnyttja denna samhällstillgång? Detta varnar herr Lundberg emellertid för, ty arbetskraftsbristen i Hallstavik, Gimo m. fl. platser är, säger han, mycket besvärande. Men den är väl inte besvärligare där än på andra ställen, t. ex. utefter Gästriklands kust? Ju närmare vi kommer stockholmsområdet, desto mera besvärande blir den. Nej, vi kan inte göra sådana avvägningar, utan vi måste bedöma frågorna ur samhällssynpunkt och se efter vilka resurser som behövs för att vi skall kunna utnyttja en naturtillgång, som för närvarande inte förräntar sig. Och hur skall vi få en bättre skogsvård, om vi inte kan utnyttja de överskottskvantiteter som nu finns i våra skogsmarker? Det är detta som ytterst är problemet. Vi måste bygga ut befintliga industrier eller skapa nya toppmoderna industrier som kan ta upp konkurrensen på världsmarknaden. Och någonstans måste vi ju placera dessa företag. Mälarens vatten får inte förorenas, säger herr Lundberg, och där delar jag hans uppfattning. Det vore i högsta grad oklokt att bygga en sulfatfabrik vid Mälaren. Men vi får inte heller förorena Östersjöns vatten, säger herr Lundberg. Var i Herrans namn skall vi då lägga en sulfatfabrik? Här gäller det att tillvarata överskottet av speciellt talloch lövvirke inom detta område, där vi nu inte har tillräcklig industriell kapacitet. Om vi undersöker möjligheterna utefter kusten från Dalälven i norr, så finner vi efter vad jag kan förstå inget annat område som är lämpligt för en modern massafabrik än hargsregionen. I länsstyrelsens planering ingår också att fritidsbebyggel- sen inte skall släppas fram i detta område, utan att det skall reserveras för industriändamål. Det är därför en alldeles riktig samhällsekonomisk bedömning att hargsområdet, som i dag inte är exploaterat i nämnvärd grad och som har Östersjöns tredje djuphamn i storleksordningen, reserveras för industriell användning. Det är väl sådan planering och förutseende som herr Lundberg efterlyste. Om man någonstans har varit förutseende rent samhällsekonomiskt, så är det just i hargsområdet. Herr talman! Detta var några synpunkter, som vi från skogsägarnas sida måste ha som underlag för en bedömning när det gäller att utnyttja de virkesförråd som finns inom det här området. Det sista ordet är väl ännu inte sagt i denna fråga, utan det krävs naturligtvis fortsatta ingående undersökningar och prövningar. Men någonting måste göras för att vi på ett bättre sätt skall kunna ta vara på en tillgång som nu blir illa utnyttjad."
prot-1966--ak--25,John Lundberg,Socialdemokraterna,man,10088.005093378608,10262.72495755518,"Herr talman! Herr Grebäck sade att just de skogsområden som finns i Stockholms län måste kunna utnyttjas. Jag vill erinra om att den stora skogsindustri som arbetar där, nämligen Hallstavik, äger mycket liten del av skogsarealen och därför är direkt beroende av att köpa virke. Herr Grebäck vet emellertid att denna industri nu planerar en mycket kraftig utbyggnad. är det den utbyggnaden man vill hindra? Herr Grebäck kanske i stället menar att Hallstavik borde överföras till skogsägarna? Det må vara hänt, eftersom vattenområdet redan är förstört. Jag förvånar mig emellertid över att herr Grebäck här talar om en planering ur hela samhällets synpunkt. Jag förutsätter att han läser RLF:s tidning. I numret för den 28 april understrykes behovet av en kraftig strukturrationalisering inom skogsindustrien och centralisering av industrierna. Man talar även om den hotande prisutvecklingen. Dagens Nyheter för i dag framhåller att en kraftig koncentration är önskvärd inom svensk cellulosaindustri på grund av den hårdnande marknaden internationellt sett. Menar herr Grebäck att man då, utan hänsyn till en planerad utbyggnad i Hallstavik, utan hänsyn till den internationella konjunkturen och prisutvecklingen på området, skall till varje pris bygga ytterligare en fabrik, för att om några år — som det står i tidningsartiklarna — komma i den situationen att man får slå igen? Jag tycker att det är orimligt. Dagens Nyheter har i dag även ett referat om den riksplanering av marken som statsrådet Palme överväger. Det är självklart att en sådan planering utgör en positiv sak och något som kan medföra en viss ljusning även i det avseende vi nu diskuterar. Men herr Grebäck och jag har som alla andra medborgare ett visst ansvar även mot svensk industri, och jag förutsätter att herr Grebäck känner förhållandena så väl att han vet att det icke bara gäller att bygga de många enheterna inom industrien; man måste också skapa möjligheterna för dem att producera och hållas i drift samt få det företagsekonomiska underlag ingen kan komma förbi."
prot-1966--ak--25,Erik Grebäck,Centerpartiet,man,10274.67741935484,10381.689303904925,"Herr talman! Jag skall inte här ta upp någon debatt med herr Lundberg om det rent tekniska förfarandet när det gäller att omvandla virke till massa; det skulle föra alldeles för långt. Men jag vill framhålla att Hallstavik är en sulfitfabrik där man använder granvirke och även en del lövvirke. Den planerade, mycket eventuella, fabriken i Hargshamn, skulle vara inriktad på tallvirke och lövvirke, där det finns ett mycket stort virkesöverskott, och alltså utgöra en komplettering av möjlighe- terna att industriellt utnyttja vära virkestillgångar. Inte vill skogsägarna i det här området komma Hallstavik till livs. Tvärtom! Det är en utomordentligt värdefull industri som fyller en mycket stor uppgift. Så dumma är vi inte att vi vill vara med att skära av den gren vi själva sitter på. Den planerade industrien skulle eventuellt utnyttjas för att tillverka vad som kallas craftliner, där riskerna för förorening av vatten är mycket mindre än i en vanlig massafabirk, och där lukten är mera besvärande. Man bör känna till dessa och andra problem, om man skall uttala sig i frågan. Det förvånar mig att herr Lundberg kan vara så tvärsäker i sina påståenden utan att ha tagit del av de utredningar som ligger bakom det ifrågavarande projektet."
prot-1966--ak--25,Bror Nyström,Socialdemokraterna,man,10531.14601018676,10964.219015280138,"Herr talman! Egentligen är det överflödigt att jag tar kammarens tid i anspråk. Men eftersom jag är medansvarig för planeringen av roslagsområdet, som berörs i herr Lundbergs interpellation, vill jag säga några ord. Interpellationen synes vara grundad på den felaktiga föreställningen, att ianspråktagandet av marken i Roslagen för industrilokalisering, bebyggelseutveckling, uppförande av fritidshus och utövande av rörligt friluftsliv sker planlöst och improviserat. En sådan föreställning strider emellertid helt mot det verkliga förhållandet åtminstone i Stockholms län. Stockholms län torde nämligen vara föregångslänet i fråga om översiktlig regionalplanering. I början på 1950-talet igångsattes en intensiv översiktlig planering genom länsstyrelsens försorg med huvudvikt på det känsliga kustoch skärgårdsområdet inklusive hela Roslagen. I interpellationen heter det: »Roslagen får inte göras till ett planlöst gytter för spekulativa intressen utan hänsyn till människor som där skall leva och bo, ha en säker försörjning och kunna få trivsel, rekreation och andra nyttigheter.» Alla måste väl instämma i det uttalandet. Men det är just detta som sedan lång tid varit motivet för länsöversiktsplaneringen. Roslagen har faktiskt varit den sektor av regionen som trätt i förgrunden vid den Ööversiktsplanering som bedrivits sedan årtionden tillbaka. I utredningar, motioner och interpellationer har under årens lopp oavlåtligen påvisats nödvändigheten av en uppryckning av näringslivet i Roslagen, så att denna länsdels avfolkning stoppas. Bakom dessa strävanden har legat uppfattningen, att Roslagen — genom sitt geografiska läge nära huvudstadsområdet, sina markutrymmen och sin latenta arbetskraftsreserv till följd av jordbrukets och skogsbrukets minskade betydelse i sysselsättningshänseende — har naturliga förutsättningar för en viss industriell expansion, i huvudsak koncentrerad till tre centralorter, nämligen Norrtälje, Hallstavik och Östhammar. Länsstyrelsen har därför, i samverkan med bland andra arbetsmarknadsstyrelsen, i alla grenar av samhällsplaneringen ständigt arbetat för ökade sysselsättningsmöjligheter i främst dessa centralorter genom en industriell expansion baserad på områdets naturliga betingelser. I all länsöversiktsplanering för utvecklingen inom Roslagen under efterkrigstiden och redan dessförinnan har följaktligen den bestämda utgångspunkten varit, att till Hargshamn om möjligt skulle förläggas en större industri. I fritidsplaneringen för Stockholms läns skärgårdsområde av år 1964 har i enlighet härmed trakten kring Hargshamns utlagts såsom industriellt influensområde. Runt detta område har sedan utlagts ett bälte av mark där fritidsbebyggelse inte bör förekomma. plan framfördes även synpunkter om att det område där fritidsbebyggelse inte borde förekomma skulle ytterligare utvidgas, vilket iakttagits vid den länsöversiktsplanering som nu slutförts. Det är därför fullständigt felaktigt att — såsom interpellanten synes tro — lokaliseringen av en massafabrik till Hargshamn skulle strida mot fritidsplaneringen och den allmänna länsöversiktsplaneringen. Tvärtom har i denna trakt industrilokaliseringen varit det primära vid all översiktsplanering. Då det gäller arbetskraftsförsörjningen är interpellantens argument enligt min uppfattning inte heller hållbara. Motivet till arbetet med att industrialisera Hargshamn såsom ett led i uppryckningen av Östhammar har varit de mycket besvärliga avfolkningsproblem, vilka som bekant sedan länge präglat östhammarsområdet. Det nuvarande Östhammarsblocket — Östhammars och Öregrunds städer — har under perioden 1950—1965 minskat sitt invånarantal med i runt tal 1500 personer. Denna befolkningsminskning har ägt rum trots de industriutbyggnader vilka, såsom interpellanten påpekat, pågår i grannorterna Hallstavik och Gimo. Orsaken härtill är givetvis nedläggningen och rationaliseringen av jordbruket samt rationaliseringen av skogsbruket, som leder till ett minskat arbetskraftsbehov. Tillgängliga prognoser för jordbruksutvecklingen inom det omfattande jordbruksområde det här gäller visar på fortsatt negativ utveckling för bygden, om inte lämpliga åtgärder sätts in i tillräcklig omfattning. Länsstyrelsen har i likhet med berörda myndigheter på riksplanet och i länet funnit, att det skulle vara synnerligen olyckligt, därest norra delen av Roslagen bleve en ren ödebygd. En harmonisk utveckling av länet — och inte bara av detta, utan av hela regionen från Gävle och ned mot Stockholm — motiverar förekomsten av en levande centralort, som just bör utgöras av Östhammar. Redan nu representerar Östhammar mycket omfattande samhällsinvesteringar. Dessa skulle förvandlas till felinvesteringar om inte befolkningsoch näringsunderlaget förstärks. Den befolkningsminskning som hittills ägt rum har huvudsakligen inneburit utflyttning av yngre arbetskraft. Oavsett om en större industrianläggning kommer till stånd eller inte erfordras, herr Lundberg, en påspädning av de svaga årskullarna i de mest produktiva åldrarna, försåvitt den nuvarande centralorten Östhammar skall vara livskraftig i framtiden. I jämförelse med de besvär som den bofasta befolkningen i de oftast tätbefolkade trakterna kring övriga sulfatfabriker får vidkännas — såsom exempelvis den här omnämnda sulfatfabriken i Skutskär, belägen mitt i samhället — framstår olägenheterna av en sulfatfabrik i Hargshamn, i vad avser det rörliga friluftslivet, enligt min uppfattning såsom synnerligen överdrivna. Avslutningsvis vill jag än en gång betona, att interpellantens uttalande att en sulfatfabrik i Hargshamn skulle vara uttryck för en irrationell planlöshet enligt min mening är fullständigt ogrundat."
prot-1966--ak--25,John Lundberg,Socialdemokraterna,man,10975.543293718169,11181.808149405773,"Herr talman! Jag vill citera ett tidningsreferat från den 2 februari där det sägs: »Stockholmarna får gå utomläns om de vill bygga fritidsstugor. De som bor i Stockholms stad och län får i framtiden söka sig utanför Storstockholm om de vill bygga fritidsstugor, sa landshövding Erik Westerlind i sitt inledningsanförande vid en konferens i Nynäshamn.» Landshövding Westerlind konstaterade vidare att man hade planerat ytterligare 80 000—90 000 fritidsstugor i lä- net men att man nu måste dra ned antalet till 70 000. Vår fritid kostar ungefär 5 miljarder kronor om året. Vi vet vilken ekonomisk betydelse fritidslivet har. Tror herrarna att man vinner mera på att få en industri som skall leverera en råvara men som inte ger någon utdelning åt skogsägarna? Titta på Sydsveriges senaste bokslut, så får ni se vad bönderna fick ut av sin skog! Herr Nyström talar om att arbetskraft finns. Men det är alldeles klart att det i Gimo för närvarande fattas er: arbetskraft på 293 personer och i Hallstavik på 73 personer. Det saknas också ungefär 250 bostäder i Gimo och omkring 75 i Hallstavik. Menar herr Nyström att man från kvoterna skall avdela den byggenskap som erfordras för att bygga bostäder i området i Harg och ny industri för att tillfredsställa hans önskningar. Skall kvoten i så fall tas från ex. Norrtäljes? Herr Nyström bör inte heller bortse ifrån att i det område som man nu vill förstöra för fritidsbebyggarna redan finns något tusental fritidshus. Det har här talats om lukt och vattenföroreningar. Vad skulle herr Grebäck och herr Nyström säga, om de själva tvingades bo inom detta område — herr Grebäck gör det kanske redan? Är herrarna omedvetna om de besvärligheter som följer av vattenföroreningar m, m. i ett område som har avsetts för fritidsfolk? Tusentals människor har byggt fritidsstugor i detta område, eftersom det i den första planen inte talades om någon vattenoch luftförorenande fabrik. Vill man nu utan att känna något ansvar mot dem inkräkta på deras fritidsmark och rekreationsmöjligheter? Det är enligt min mening att lura människor till en felinvestering, och det är ett anmärkningsvärt beteende. Även arbetarna behöver numera ha möjlighet att skaffa sig fritidsstugor, men de har inte råd att resa hur långt som helst. Man bör tänka även på den delen av arbetskraften."
prot-1966--ak--25,Bror Nyström,Socialdemokraterna,man,11190.993208828524,11242.402376910017,"Herr talman! Jag vill tala om för herr Lundberg att vi ingalunda har något emot fritidsbebyggelse i Roslagen. Även Roslagen är emellertid en landsända som måste leva på någonting, och man kan inte leva enbart på fritidsbebyggelse. I mitt föregående anförande påpekade jag att det aktuella området vid Hargshamn redan på ett tidigt stadium var planerat för industrier. Det är visserligen sant att ett och annat fritidshus ligger där redan nu, men enligt planerna skall det inte bli mera fritidsbebyggelse där. Herr Lundberg framhåller att människorna snart måste bege sig utanför Stockholms län för att få en fritidsbostad. Det må väl vara hänt. Vi kan, som jag sade tidigare, inte ha bara fritidsbebyggelse i Roslagen, utan det måste där skapas en livskraftig bygd, och vi behöver industrier för att kunna livnära OSS."
prot-1966--ak--25,Axel Jansson,Vänsterpartiet,man,11333.166383701187,11931.876061120543,"Herr talman! Det skall kanske beklagas att nu ifrågavarande projekt har tagits upp till behandling i samma interpellation; förutsättningarna för å ena sidan projektet i Hargshamn och å andra sidan projektet i Kvicksund är ju så skilda. Hargshamn är beläget i ett industrifattigt område. Jag har svårt att bedöma de interna förhållandena i och för sig på denna plats, men ett torde vara ostridigt, nämligen att där behövs industri. Tillkommer det inte en industri av det slag som herr Lundberg nu vill förhindra, får det bli en annan industri i stället; befolkningen i området måste ju ha någon utkomstmöjlighet. Problemet Kvicksund ligger annorlunda till. Det handlar där om ett område med kanske det mest differentierade näringsliv som vi över huvud taget har i vårt land. Det är inte ont om arbetstillfällen i detta område. I hela mälarregionen finns det över huvud taget många arbetsplatser. Här föreligger alltså en helt annan problematik att ta ställning till. Det angelägnaste är enligt min mening att på något sätt vidta åtgärder för att skydda Mälarens vatten mot förorening. Tillåt mig i detta sammanhang göra en liten erinran. Vid 1950-talets slut begärde Billerudskoncernen att få bygga en fabrik i Kvicksund, men vid den tidpunkten — och då var Mälarens vatten ändå inte så illa utsatt som nu — avstyrkte vår vattenvårdsexpertis mycket bestämt denna begäran. För inte så länge sedan kom man igen med en ny ansökan, ganska överraskande för övrigt, och ville sätta upp en cellulosafabrik med dubbelt så stor kapacitet som det var fråga om när ärendet avstyrktes i slutet av 1950-talet. Mälaren är Sveriges största råvattentäkt. Den förser cirka 1,2 miljon människor med vatten, bl. a. hela västeråsområdet och stockholmsregionen. Antalet konsumenter beräknas år 1975 ha stigit till 1,4 miljon, och inom överskådlig framtid beräknar man att kanske 3 miljoner människor kommer att få sitt vatten från Mälaren. Kan det då vara rimligt att tillåta en industri av detta slag att slå sig ned vid Kvicksund? För närvarande får Mälaren ta emot avloppsvatten från bebyggda områden som hyser cirka 1,1 miljon människor. 1967 beräknas detta antal ha stigit till 1,3 miljon och på lång sikt till 2 miljoner. Avlopp från minst 350 000 WC släpps nu, enligt en tidningsuppgift häromdagen, direkt eller indirekt ut i sjön utan att passera reningsverk. Mälaren är förutom vattentäkt också en betydelsefull fritidssjö. Det beräknas att det finns omkring 8 000 fritidshus i närheten av Mälarens vatten. Vederbörande regionsorgan i Västerås har beräknat att det i detta område före år 2000 kommer att finnas ytterligare 8 000 fritidshus, varav 3 500 i närheten av Kvicksund. Från den utgångspunkten hade det varit önskvärt om statsrådet i sitt svar på herr Lundbergs interpellation hade varit litet mer konkret och kanske tagit ställning i själva sakfrågan; jag kan hålla med herr Lundberg om att svaret är litet allmänt hållet. Mälarens vatten är redan nu allvarligt hotat. Vi borde kunna vara eniga om att en ny industri av detta slag i Kvicksund ökar hotet mot Mälarens vatten. Därför finns det enligt min mening inget skäl att tillåta att det nu planerade företaget förläggs till Kvicksund. Statsrådet säger, att vi i Sverige inte har någon styrning av näringslivet. Det kan väl vara riktigt på sitt sätt. Men frågan är om statsmakterna eller andra myndigheter har möjligheter att hindra det fria näringslivet att breda ut sig på det sätt som nu är tänkt. Enligt min uppfattning har man detta, kanske inte inom lokaliseringspolitikens ram men väl inom ramen för vår hälsovårdslagstiftning och immissionslagstiftning. Även om alla utredningar på detta område inte är färdiga, tror jag att hälso- vårdslagstiftningen ger möjligheter till ett ingripande. Hälsovårdsstadgan har många materiella detaljregler, som man kan sammanfatta i en enda formel: det är förbjudet att åstadkomma sanitär olägenhet. Om 8 000 familjer, som skaffat sig fritidshus i ett område, en vacker dag upptäcker att de inte längre kan bada i den sjö, vid vilken de placerat sina fritidsstugor, på grund av att vattnet är förorenat, då är det självklart att formeln om sanitär olägenhet kan tilllämpas. Det finns även annan lagstiftning som skulle kunna ifrågakomma i detta fall och som tidigare diskuterats här i riksdagen. Den kommunistiska gruppen har t. ex. motionerat beträffande en särskild lagstiftning om luftförorening och vattenförorening. Men jag tror som sagt att man redan med stöd av hälsovårdsstadgans 63 $ om tillståndstvång verkligen kan förhindra att Kvicksundsprojektet kommer till stånd. Jag har i all korthet velat framföra dessa synpunkter; om denna debatt har någon som helst betydelse när vattendomstolen i sommar — eller om det möjligen blir i höst — skall fatta beslut om projektet Kvicksund vill jag inte ha stått utanför diskussionen. Vi strävar efter att höja svenska folkets standard, och det måste väl ändå erkännas av alla att frisk luft och rent vatten också hör till hög standard."
prot-1966--ak--25,Folke Trana,Socialdemokraterna,man,11333.166383701187,11393.064516129034,"Herr talman! Herr Lundberg läste upp ett tidningsreferat — huruvida detta låg till grund för hans interpellation vet jag inte — av vad landshövding Westerlind yttrat om att man i Stockholms län inte har utrymme för den fritidsbebyggelse som erfordras för att tillgodose storstockholmsområdets behov. Att detta visat sig vara fallet beror helt enkelt på att det har gjorts en ordentlig planering för ifrågavarande fritidsbebyggelse både på länsplanet och inom kommunerna. Företrädarna för berörda kommuner anser att man inte kan lusa ned terrängen med hur mycket fritidsbebyggelse som helst. Vart skulle trivseln då ta vägen, herr Lundberg? Det måste ändå finnas litet orörd natur kvar. Vidare räknar herr Lundberg upp hur många bostäder det fattas i Gimo och hur många bostäder som fattas i Hallstavik. Jag kan tala om för herr Lundberg att det i dag fattas 400 lägenheter i Östhammar, vi har med andra ord 400 familjer som står i bostadskön där."
