protocol_id,name,party,gender,start_segment,end_segment,text
prot-1966--ak--25,Ragnar Edenman,Socialdemokraterna,man,8520.976230899832,9200.348047538202,"Herr talman! Situationen här är litet främmande för mig: jag vet inte riktigt vad jag skall argumentera emot. Alla inlägg har varit korta och framförts i en låg ton, och talarna har med en välvillig tolkning kunnat ansluta sig till Kungl. Maj:ts förslag. Men man Önskar, såsom den siste ärade talaren uttryckte det, få ytterligare argument och belägg för riktigheten av den anvisade vägen. Det som är egendomligt är inte att några framstående socialdemokrater har väckt en motion om uppskov. Man kan förstå att t.ex. min gamle kollega Sigurd Lindholm, som kanske är en av riksdagens främsta operavänner, är speciellt intresserad av denna fråga. Men vad jag inte kan förstå, herr talman, är att samtliga borgerliga ledamöter i utskottet omedelbart »hoppar på» denna ståndpunkt och lämnar den ursprungliga borgerliga motionen, vilkens syfte var klart i sak, nämligen att operaklassen skulle bibehållas vid musikhögskolan i Stockholm. Det är sådana egendomliga utslag i vårt parlamentariska liv som man kanske skall grubbla över i andra sammanhang, herr talman, än just från andra kammarens talarstol, men jag har ändå velat fästa uppmärksamheten härpå. Det är inte någon fara med ett upp- skov, framhåller herr Kellgren, och herr Lindholm var inne på samma linje. Nej, det är det naturligtvis inte, om man inte har en mycket sangvinisk inställning i denna utbildningsfråga. Men förutsättningen för det uppskov, som enligt vad jag skrev i propositionen innebär, att utbildningen inte kan komma i gång förrän tidigast till hösten 1967, eftersom man skulle behöva göra — det var min övertygelse och är det självfallet alltjämt — en översyn av den läroplan, som utredningsmannen lagt fram, är att vi har ett principbeslut från riksdagens sida om var denna utbildning skall förläggas. Byggnadsstyrelsen vill omedelbart i juni ha ett besked, om man vid planeringen för statens skola för scenisk utbildning i det s. k. Kronobageriet skall räkna med den musikdramatiska linjen eller inte. För den händelse riksdagen skulle följa utskottsmajoritetens linje, kan regeringen och myndigheterna inte planera på ett tillfredsställande sätt. Vi kan genomföra den av utskottet begärda ytterligare undersökningen och vi kan naturligtvis anstränga oss till det yttersta för att försöka övertyga herrar Kellgren, Lindholm och ytterligare några ledamöter om att den linje vi valde i år är den riktiga, men vi kan inte uträtta någonting konkret. Vi måste vänta på ett riksdagsbeslut i april— maj nästa år, och vi kan inte komma i gång med denna utbildning förrän tidigast hösten 1968. Detta är enligt min mening ett mycket allvarligt argument, som kammarens ärade ledamöter verkligen bör lägga på minnet. Det är alltså inte så ofarligt som det låter att vänta på ytterligare utredningar i denna fråga. Jag förstår inte herr Lindholms misstänksamhet på denna punkt. Operan försvinner, säger han, i utredningsmannens version. Han målar en bild av — jag erkänner det — en fruktansvärd utveckling på det musikdramatiska och allmänkulturella området, då det inte skulle förekomma någon opera i klassisk bemärkelse utan tydligen enbart operetter, musicals och liknande. Det är en för mig fullkomligt hårresande tanke, och jag vill omedelbart ansluta mig till de led som bekämpar denna utveckling — jag ställer mig gärna efter herr Lindholm och låter honom hålla baneret. Ingen har tänkt en sådan utveckling, inte ens utredningsmannen. Jag har verkligen vid ideliga tillfällen försökt hålla långa förhör med honom i detta avseende. Det rör sig alltså, herr Lindholm, om ett misstag och oberättigade farhågor. Det vore emellertid också — det vill jag tillägga — mycket olyckligt, om den musikdramatiska = utbildningen inte skulle följa med i den allmänna utvecklingen. Vad vi önskar är att det inte bara skall finnas en kunglig opera i Stockholm. Vi vill ha ut operan i hela landet, och inte bara operan; vi vill vidga hela den musikdramatiska sektorn, och då kommer också operetter och även musicals in i bilden. Det är alltså här fråga om ett mycket stort utbildningsprogram. Man kan formulera det så att vi inte bara vill ha opera i klassisk bemärkelse, utan även operetter och musicals, och att utbildningen skall ta hänsyn till detta. Det är därför vi också numerärt har vidgat basen genom att ha tre skolor: en i Stockholm, en i Göteborg och en i Malmö. Jag hörde för inte så länge sedan Elisabeth Söderström sjunga en musicalmelodi eller kanske t. o. m. en vanlig visa i TV. Det är verkligen underbart när våra stora operaartister går ut även på andra områden än den klassiska operans. Jag kan emellertid inte låta bli att ironisera litet över alla farhågor för hur det skulle ha gått för våra stora sångliga begåvningar — en Jussi Björling eller en Birgit Nilsson. Många av kammarens ledamöter har kanske läst en artikel, där man såg en bild av vår framstående operasångerska och under den en text som löd ungefär så: Hur skulle det ha gått för henne, om operaklassen inte hade funnits utan bara denna musikdramatiska utbildning? — Det är självfallet att begåvningar på den världsnivå som dessa bägge exempel hänför sig till går tvärsigenom alla bestämmelser. Detta är nog ett argument som herr Lindholm skall fundera en gång till på. Tror han verkligen på allvar med ledning av det material han har fått att en Birgit Nilsson eller en Jussi Björling inte skulle komma med i den nya form av musikdramatisk utbildning det här är fråga om? Det är, som herr Arvidson sade, hela tiden samma människor som handhar utbildningen. Jag föreställer mig att den intagningsnämnd, den styrelse, de lärare och den studierektor det kan bli tal om skulle utgöras just av de män och kvinnor som nu är verksamma inom musikaliska akademien och operan. Vi har inte tillgång till några andra; ingen vet det bättre än herr Lindholm. Varför skulle de bli så förbenat egendomliga i sin inställning till genier och begåvningar därför att de skulle ta hand om dem i en skola av annan art? Jag skall, herr talman, inte gå in på själva sakmotiveringen för förläggandet av operaklassen till statens skola för scenisk utbildning. Denna motivering står att läsa i både propositionen och utskottsutlåtandet, och herr Arvidson har här grundligt gått igenom den. Jag vill till sist understryka att både propositionen och reservationen innebär ett provisorium. Det bör ses mot bakgrunden av att vi, hur varmt vi än önskar det, inte kan få någon ny musikhögskola i en handvändning. Den saken tar sin tid. Byggnadsstyrelsen har gjort framställning om att få projektera, men det är fråga om ett miljonbygge, i tvåsiffriga tal, som kanske tar fyra, fem eller sex år. Vi kan inte vänta med den musikdramatiska utbildningen tills en ny musikhögskola blir färdig, alldeles oavsett om den får rum på den nuvarande tomten eller måste flyttas till en annan. Jag står givetvis kvar vid förslaget om den nuvarande tomten, eftersom vi har planerat att förlägga den nya skolan dit, men jag vill inte yttra mig om det. Då säger reservanterna: Om det blir andra lokalmässiga förutsättningar genom en ny musikhögskola, låt oss då ompröva hela frågan! Jag kan säga detsamma. Men jag vill inte vänta tills den dagen kommer; jag vill göra någonting nu. Det vill också operastyrelsen och musikaliska akademien. De accepterar propositionen som ett provisorium, eftersom detta provisorium skulle vara bättre än nuläget, men de vill inte permanent stanna vid den lösningen. Jag kan därför inte förstå annat än att reservanternas mjuka skrivning på denna punkt borde kunna tillfredsställa även de motionärer, som ju bara har den inställningen att man ytterligare skulle fundera på denna fråga. Om den också kunde tillfredsställa de borgerliga motionärerna med fru Gärde Widemar i spetsen, vilka ursprungligen hade en annan uppfattning i sak, skulle jag naturligtvis vara ännu gladare."
prot-1966--ak--25,Sigurd Lindholm,Socialdemokraterna,man,9210.636672325978,9406.595925297115,"Herr talman! Ecklesiastikministern tyckte att jag hade varit en smula sangvinisk, när jag förordat uppskov på ett år, enär planeringen i så fall inte skulle kunna genomföras. Men avsikten med uppskovet var ju att pröva, om den planering som man avser att genomföra är den lämpligaste eller ej. Om det vid en sådan översyn skulle komma fram skäl, som så starkt talar för att operaklassen bör vara kvar i musikhögskolan, skall väl planeringen bedrivas med utgångspunkt härifrån och inte med utgångspunkt från det förslag som nu behandlas av kammarens ledamöter. Jag tror, herr talman, att det inte enbart är herr Kellgren och jag som skulle behöva övertygas. Jag betraktar det inte såsom helt uteslutet att man även inom ecklesiastikdepartementet efter en översyn, vid vilken fackkunnigt folk har medverkat, kan få en annan uppfattning på denna punkt. Jag är glad över att ecklesiastikministern så bestämt tar avstånd från den konklusion som har dragits av Sångoch talpedagogernas förbund, när de gör vissa referat av utredningen. Men nog måste väl ecklesiastikministern ge mig rätt i att det är möjligt för dem att tolka utredningen så som de gjort. Om man läser på s. 46 i utredningen finner man att, beträffande dem som söker in till operaskolan, utredningsmannen säger bl. a. följande: »Bristerna härvidlag har inneburit att skådespelaranlag sällan fått vara utslagsgivande för val av sångarbanan och att många dramatiskt obegåvade men vokalt väl utrustade aspiranter siktat på operabanan trots att deras sceniska talang visat sig otillräcklig.» Detta är ett ganska bestämt uttalande från utredningsmannens sida, och jag har icke i propositionen eller annorstädes tidigare funnit något avståndstagande från denna passus i hans förslag. Men jag får väl nu tolka ecklesiastikministerns yttrande så, att utredningsmannens skarpa formulering på denna punkt icke kommer att vinna gehör, utan att de verkligt stora sångarbegåvningarna skall få sin chans i framtiden liksom hittills. Vi bör ändå komma ihåg att opera från början till slut är vokaloch instrumentalmusik."
prot-1966--ak--25,Nils Kellgren,Socialdemokraterna,man,9417.20713073005,9564.23599320883,"Herr talman! Jag tyckte nog att ecklesiastikministern var alltför pessimistisk vad gällde möjligheterna att planera arbetet inom sitt departement på ett sådant sätt att förslag kan föreläggas riksdagen vid en tidpunkt som gör det möjligt för riksdagen att fatta beslut vä- sentligt tidigare än, som statsrådet sade, i april —maj. Jag föreställer mig att om ett förslag föreläggs riksdagen i statsverkspropositionen, så skall det finnas möjlighet för riksdagen att fatta beslut redan i februari månad. Vi är snart inne i juni månad, och jag kan inte se att någon väsentlig tid skulle gå förlorad ur planeringssynpunkt, om vi skjuter på beslutet sju, åtta månader. För närvarande är det så kärvt på byggnadsmarknaden och så ont om arbetskraft på detta område att det i och för sig inte behöver innebära någon större olägenhet, att man vid förberedelsearbetet får grundligt fundera på exempelvis frågan om hur Kronobageriet på bästa sätt skall kunna byggas om. Med ett ordentligt tilltaget utrymme för planering brukar man kunna vinna åtskilligt i tid när det gäller att genomföra ett projekt. Jag tror alltså inte att ett uppskov med beslutet något halvår behöver medföra de allvarliga olägenheter som ecklesiastikministern, helt naturligt, här försökte måla upp."
prot-1966--ak--25,Ragnar Edenman,Socialdemokraterna,man,9850.993208828524,10793.48896434635,"Herr talman! Jag skall inte hålla någon föreläsning om arbetsförhållandena i kanslihuset; jag utgår ifrån att herr Kellgren inte kan få någon större förståelse för dem. Däremot tror jag att herr Lindholm vet ungefär hur det ligger till. Men herr Kellgren måste väl inse att man inte i juni månad, som snart är inne, kan begära att byggnadsstyrelsen, teateroch orkesterrådet och övriga remissmyndigheter skall framlägga ett nytt förslag över sommaren, så att regeringen kan i nästa års statsverksproposition avge ett förslag i denna fråga som enligt utskottets bedömning är mycket komplicerad. Det är alldeles självklart att vid ett uppskov något riksdagsbeslut inte kommer att föreligga förrän nästa vår. Jag vill därutöver bara till herr Lind- holm säga att vi väl inte i propositionerna brukar anstränga oss att ta avstånd från alla uttlanden i ett betänkande vilka vi inte kan instämma i. Vad som står i propositionen är ju det som gäller. I det här fallet har jag personligen blivit övertygad om att herr Lindholms tolkning av utredningsmannens uttalande inte är riktig, men jag har som sagt ingen anledning att dementera varje skrivning i betänkandet. Jag kan däremot — och jag gör det med glädje — muntligen ansluta mig till den uppfattningen att syftet inte på något sätt är att hindra sångbegåvningar som kanske saknar dramatisk begåvning att komma in i den nya skolan. Utgångspunkten är ju att det finns en grundutbildning, och de flesta elever kommer i fortsättningen att ha genomgått musikhögskolans sångklass, när de söker till den nya skolan. De är alltid redan sångligt utbildade och det är bara den alldeles speciella formen av skolning i operasång som återstår för dem. Den nuvarande operaklassen är tvåårig. Den blivande skolan blir treårig. Enligt de föreliggande läroplanerna för denna skola, som jag hoppas skall kunna ytterligare förbättras, är de musikaliska inslagen mer kvalificerade och mer omfattande än i den hittillsvarande operaklassen. Sångbegåvningarna, herr Lindholm, tror jag vi gemensamt skall kunna rädda. I propositionen föreslås vissa regler om överlåtelse och utmätning av fordran på överskjutande preliminär skatt enligt uppbördsförordningen. Reglerna innebär förbud mot överlåtelse av sådan fordran samt vissa begränsningar av rätten att erhålla utmätning därav. Som villkor för utmätning föreslås att kreditkort som avser den skattskyldige kommit utmätningsmannen till handa. Vidare skall utmätning i enskilt mål få äga rum endast om ansökningen inkommit senast den 1 september och om vad som kan utmätas täcker kostnaderna för förrättningen. Det föreslås att vid utmätning i enskilt mål som ej avser underhållsbidrag ett belopp om 300 kr. skall undantas från utmätning. De föreslagna bestämmelserna, som betingas främst av hänsynen till arbetsbelastningen och arbetsrutinen hos de berörda myndigheterna, föreslås skola gälla även överskjutande preliminär varuskatt. att alla slag av fordringar med det allmänna som borgenär kunde bli föremål för kvittningsförfarande,"
prot-1966--ak--25,Sten Sjöholm,"Liberalerna, Folkpartiet",man,10077.76740237691,10793.48896434635,"Herr talman! Det utskottsbetänkande som vi nu skall behandla berör frågor som jag råkar vara litet förtrogen med. Det gäller utmätning av överskottsskatt, som i betänkandet kallas överskjutande skatt, d. v. s. de pengar som mer än hälften av alla skattebetalare varje år får tillbaka på debetsedeln före jul. Beloppets storlek framgår av de kreditkort, som de lokala skattemyndigheterna gör upp. Dessa passerar utmätningsmannen, som numera kallas kronofogde, för att staten skall kunna tillgodogöra sig detta överskott, om vederbörande är skyldig staten pengar. Privata enskilda borgenärer har nu lärt sig hur det ligger till, och det förekommer många ansökningar från privata borgenärer om utmätning av överskottsskatt. I Hälsingborg får utmätningsmannen i november månad kilovis av handlingar om betalningsföreläggande, i vilka man begär utmätning av överskottsskatt. Propositionen och även utskottsmajoriteten vill att det skall göras en viss inskränkning i enskildas rätt att få utmätning i dessa pengar. Dels skall en tidsgräns fixeras, så att ansökan skall inkomma före 1 september och dels skall införas en spärr på 300 kronor. Överlåtelser av sådana här fordringar förekommer också; det har hänt att de som skall få pengar tillbaka har i god tid överlåtit denna fordran på annan person, och därmed omintetgjort alla försök till utmätning. Man tänker nu sätta stopp för detta, vilket är rätt och riktigt. Det finns ingenting att invända däremot. Detta är inte några särskilt spännande frågor, men de berör många människor, som ofta befinner sig i små ekonomiska omständigheter. Betalningsföreläggandena ökar och ökar. Det kan gälla avbetalningskontrakt, som inte skötts, och annat. Detta medför en stor arbetsbörda för utmätningsmannen. Likväl är det häpnadsväckande och något genant att både departementschefen och utskottsmajoriteten rakt ut säger att det är den stora arbetsbördan för utmätningsmännen som gör att man måste inskränka på möjligheterna att erhålla utmätning. Dessa arbetsförhållanden bör inte få inskränka på den enskildes rätt att få sina anspråk tillgodosedda. Det vore ungefär detsamma som att säga att våra domstolar har så litet folk att de inte handlägger civilmål utan bara kriminalmål. Så kan inte ett rättssamhälle resonera. Nu finns det emellertid en annan anledning till att man bör vara restriktiv när det gäller enskildas rätt att få utmätning i överskottsskatt, t. o. m. mera restriktiv än vad departementschefen och utskottsmajoriteten vill vara. Denna överskottsskatt har uppkommit genom att staten tagit ut mera pengar från människor än man borde ha gjort — utan någon ond avsikt, men fullt medvetet. Man har konstruerat skattetabellerna för preliminärskatt så att uttaget ofta blir något större än som behövs. Det gör som sagt att mer än hälften av alla skattebetalare får pengar tillbaka. Att först utkräva i skatt mera pengar än som borde ha skett och sedan inbjuda borgenärer av alla slag att ta för sig av dessa pengar, har jag aldrig kunnat uppfatta som riktigt, och jag vet att många utmätningsmän har samma mening. Att en del skattebetalare får pengar tillbaka, beror inte på något avtal som de slutit eller på någon omständighet som de själva kunnat påverka, utan på tvångsmässiga uttag som blivit för höga. Ofta är det så att dessa människor har varit sjuka en kortare eller längre tid, vilket gör att de får pengar tillbaka på detta sätt. Därför anser jag — och jag har stöd av en hel del remissinstanser — att det över huvud taget inte skulle få göras utmätning för enskild fordran i överskottsskatt. Samma mening har hovrätten i Skåne, riksrevisionsverket — som sällan ger sig ut på äventyrligheter — Föreningen Sveriges häradshövdingar och Föreningen Sveriges stadsdomare. De anser också att eftersom detta är ett avräkningsförfarande mellan den enskilde och staten, skall nvan inte låta enskilda fordringsägare tillgodogöra sig dessa medel. Utskottet visar sig vara häpnadsväckande och också genant verklighetsfrämmande, när utskottet säger att om man satte stopp för utmätning för enskilda fordringar, skulle människor avsiktligt begära högre källskatteuttag för att på det sättet rädda pengar från utmätning. Detta uttalande är otroligt naivt. Först och främst gäller det här människor som inte har några pengar att undvara, då hade de inte hamnat i utmätningsmannens register. Om de till äventyrs skulle ha pengar som de vill gömma undan, skulle de inte göra det mitt för näsan på utmätningsmannen, eftersom man i allra värsta fall kan utmäta utbetalningskortet på överskottsskatten innan vederbörande hämtar pengarna på posten. För människor som vill gömma undan pengar finns det många bättre sätt; om de lägger pengarna på kistbotten eller sätter in dem på bank, är de väldigt svåråtkomliga för en utmätningsman. Man kan inte begära att alla skall vara insatta i detta, men den som inte är det skall inte heller uttala sig så kategoriskt och komma med en så verklighetsfrämmande idé som utskottet här gjort. Att den förekommer även hos departementschefen är knappast någon förmildrande omständighet för utskottet. Propositionens förslag, som utskottet tillstyrkt, reser en del olösliga problem. Propositionen vill sätta en spärr vid 300 kronor. Hos den som får mindre än 300 kronor tillbaka på sin skatt skall inte utmätning kunna företas för enskild fordran, men däremot för statens fordringar och även för barnbidrag, vilket senare i och för sig är riktigt. Men låt oss ta ett enkelt exempel. En person skall ha 800 kronor tillbaka i skatt. Han är skyldig böter, och dessutom har ett bokförlag en fordran på honom. Dessa belopp är lika stora. När det gäller utmätning har alla sökande samma rätt; det finns ingen prioritet därvidlag. Det innebär att av dessa 800 kronor skulle för böterna utmätas 400 kronor och för den enskilde fordringsägarens fordran 400 kronor. Nu finns det emellertid en spärr vid 300 kronor när det gäller enskild fordran. Den enskilde fordringsägaren skall alltså bara erhålla 100 kronor, eftersom de 300 kronorna inte får röras. Skall man då betala tillbaka 300 kronor till denna gäldenär, trots att han är skyldig böter med 800 kronor, och bara behålla 400 kronor för dessa? Det finns ingen möjlighet att göra på det sättet. Men om för böterna skulle utmätas 700 kronor och den enskilde fordringsägaren bara erhålla 100 kronor av dessa 800 kronor, strider det mot bestämmelserna om att medlen skall fördelas lika. Hur utskottsmajoriteten har menat att det hela skall ordnas framgår inte; jag tror inte att man har tänkt på det. Det är ett hittills olöst problem som dock måste få en lösning. Detta är inte genomtänkt. Jag har, herr talman, motionerat i denna fråga och det finns också en reservation fogad till utskottsutlåtandet, vari föreslås att utmätning inte skall tillåtas för enskild fordran. Jag har redan angivit skälen härtill. Om detta förslag genomfördes skulle alla problem lösas. Man minskar inte arbetsbördan för utmätningsmannen genom att tillåta utmätning endast över en viss gräns. Den sökande vet nämligen inte, om vederbörande skall få mindre eller mer än 300 kronor tillbaka, men han hoppas alltid att det skall vara mer än 300 kronor. Utmätningsmannen kommer därför att få en mängd ansökningar som kanske inte ger något resultat men som ändå förorsakar honom arbete. Det är nämligen inte själva utmätningen utan diarieföringen m.m. som medför det mesta arbetet. Man kommer därför inte att uppnå den önskade arbetsbesparingen. Om däremot denna möjlighet till utmätning för enskild fordran helt och hållet stoppades, skulle det medföra en avsevärd arbetsbesparing för utmätningsmannen. Reservanterna och jag anser att det enda undantag som behöver göras är utmätning för familjerättsliga underhållsbidrag, som måste ha en viss prioritet och som redan blivit favoriserade av lagstiftaren genom att de i motsats till andra fordringar är införselbara. Om rätten till utmätning inskränkes på det sätt som jag har föreslagit, behövs alltså inte denna spärr vid 300 kronor och inte heller någon tidsbegränsning. Då har man nämligen inskränkt antalet ärenden så mycket att detta inte är erforderligt ur arbetsteknisk synpunkt. Min motion innehåller även en annan idé, som tyvärr inte ens reservanterna har biträtt. Om en person häftar i skuld för restförd skatt och samtidigt skall få pengar tillbaka i Ööverskottsskatt, kvittar staten detta genom ett mycket enkelt förfarande. Detta är i och för sig riktigt. Staten skall inte betala ut pengar till en person som samtidigt är skyldig staten pengar. Men om vederbörande är skyldig staten pengar i form av böter, kan beloppet inte kvittas mot överskottsskatt, utan måste utmätas genom ett mera omständligt förfarande. Jag tror inte att någon, allra minst gäldenärerna själva, förstår varför det skall vara någon skillnad mellan dessa fall. Jag skulle vilja fråga utskottets talesman, om han förstår varför det skall vara på det sättet. Finansministern talar ofta om att förvaltningen skall rationaliseras och förbilligas. Här erbjuder sig osökt ett tillfälle att göra en rationalisering och förenkling, men då struntar man blankt i det. Det måste tydligen finnas kvar litet krångel och byråkrati. Herr talman! Helst skulle jag naturligtvis velat yrka bifall till min motion, men jag inser det hopplösa i företaget och nöjer mig därför med att yrka bifall till reservationen. Ett realiserande av dess förslag skulle också innebära ett mycket stort framsteg."
